"measure_name","dept","program","measure_id"
"Percent of priority 1 leaks responded to within 3 hours","Austin Water","Pipeline Operations","8238"
"Dollar amount of revenue recovered","Austin Water","Support Services","7067"
"Wastewater Quality: Carbonaceous Biochemical Oxygen Demand (CBOD)","Austin Water","Treatment","3862"
"Drinking Water Quality: Turbidity","Austin Water","Treatment","3861"
"Percent Invested in Capital Improvements Program (CIP) Projects compared to Planned Spending via the CIP Budget","Austin Water","Water Resources Management","6561"
"Percentage of patients who are satisfied or very satisfied with EMS customer service","Emergency Medical Services","Support Services","8231"